{
  "$schema": "https://json-schema.org/draft/2020-12/schema",
  "$id": "https://sinergy.system/schemas/settlement.receipt/v2",
  "title": "SINERGY SettlementReceipt v2",
  "type": "object",
  "additionalProperties": false,
  "$defs": {
    "hex64": {"type": "string", "pattern": "^[a-fA-F0-9]{64}$"},
    "nonnegativeDecimal": {
      "type": "string",
      "pattern": "^(0|[1-9][0-9]*)(\\.[0-9]*[1-9])?$"
    }
  },
  "required": ["schema","settlement_id","intent_id","payer_id","payee_id","providers","source_asset","source_amount","target_asset","target_amount","fees","status","finality_time","external_evidence_classes","external_references","settlement_evidence_digest","reconciled","route_id","causal_binding","authority","settlement_authority","accounting_authority","profit_recognition","execution_authority","receipt_digest"],
  "properties": {
    "schema": {"const": "settlement.receipt/v2"},
    "settlement_id": {"type": "string", "minLength": 1},
    "intent_id": {"type": "string", "minLength": 1},
    "payer_id": {"type": "string", "minLength": 1},
    "payee_id": {"type": "string", "minLength": 1},
    "providers": {"type": "array", "items": {"type": "string", "minLength": 1}, "uniqueItems": true},
    "source_asset": {"type": "string", "minLength": 1, "maxLength": 32},
    "source_amount": {"$ref": "#/$defs/nonnegativeDecimal"},
    "target_asset": {"type": "string", "minLength": 1, "maxLength": 32},
    "target_amount": {"oneOf": [{"$ref": "#/$defs/nonnegativeDecimal"}, {"type": "null"}]},
    "fees": {"type": "array"},
    "status": {"enum": ["PENDING", "SETTLED", "FAILED", "REVERSED"]},
    "finality_time": {"oneOf": [{"type": "string", "pattern": "Z$"}, {"type": "null"}]},
    "external_evidence_classes": {"type": "array", "uniqueItems": true},
    "external_references": {"type": "array", "items": {"type": "string", "minLength": 1}, "uniqueItems": true},
    "settlement_evidence_digest": {"$ref": "#/$defs/hex64"},
    "reconciled": {"type": "boolean"},
    "route_id": {"type": ["string", "null"]},
    "causal_binding": {
      "type": "object",
      "additionalProperties": false,
      "required": ["flow_kind","project_id","payment_purpose","intent_idempotency_key","intent_binding_digest","capital_authorization_schema","capital_authorization_digest","project_evidence_schema","project_evidence_digest"],
      "properties": {
        "flow_kind": {"enum": ["PRODUCTIVE_CAPITAL_FUNDING", "PROJECT_REVENUE"]},
        "project_id": {"type": "string", "minLength": 1},
        "payment_purpose": {"enum": ["productive_capital_funding", "productive_project_revenue"]},
        "intent_idempotency_key": {"type": "string", "minLength": 8, "maxLength": 128},
        "intent_binding_digest": {"$ref": "#/$defs/hex64"},
        "capital_authorization_schema": {"const": "capital.authorization/v2"},
        "capital_authorization_digest": {"$ref": "#/$defs/hex64"},
        "project_evidence_schema": {"oneOf": [{"const": "project.evidence/v1"}, {"type": "null"}]},
        "project_evidence_digest": {"oneOf": [{"$ref": "#/$defs/hex64"}, {"type": "null"}]}
      }
    },
    "authority": {"const": "SETTLEMENT_EVIDENCE_ONLY"},
    "settlement_authority": {"const": "Shtenco/synergy_pay_system"},
    "accounting_authority": {"const": "Shtenco/synergy_financial_os"},
    "profit_recognition": {"const": "NOT_PERFORMED"},
    "execution_authority": {"const": "NONE"},
    "receipt_digest": {"$ref": "#/$defs/hex64"}
  }
}
