{
  "schema": "settlement.receipt/v2",
  "settlement_id": "00000000-0000-0000-0000-000000000301",
  "intent_id": "00000000-0000-0000-0000-000000000201",
  "payer_id": "sinergy-capital-account",
  "payee_id": "project-001-escrow",
  "providers": [],
  "source_asset": "USDC",
  "source_amount": "1000",
  "target_asset": "USDC",
  "target_amount": "1000",
  "fees": [],
  "status": "SETTLED",
  "finality_time": "2026-08-18T19:31:00Z",
  "external_evidence_classes": [],
  "external_references": ["bank-settlement-001"],
  "settlement_evidence_digest": "7777777777777777777777777777777777777777777777777777777777777777",
  "reconciled": true,
  "route_id": null,
  "causal_binding": {
    "flow_kind": "PRODUCTIVE_CAPITAL_FUNDING",
    "project_id": "project-001",
    "payment_purpose": "productive_capital_funding",
    "intent_idempotency_key": "capital-project-001-auth-v2-001",
    "intent_binding_digest": "430a0bdf3868c7293fc5608813c32430fd0fb635ca9279133e8b50abe24e9ee8",
    "capital_authorization_schema": "capital.authorization/v2",
    "capital_authorization_digest": "1e814153a18850865543e08b498b60d9bce80dbd34bfb2f4c378f3fe502fe89f",
    "project_evidence_schema": null,
    "project_evidence_digest": null
  },
  "authority": "SETTLEMENT_EVIDENCE_ONLY",
  "settlement_authority": "Shtenco/synergy_pay_system",
  "accounting_authority": "Shtenco/synergy_financial_os",
  "profit_recognition": "NOT_PERFORMED",
  "execution_authority": "NONE",
  "receipt_digest": "cedcfe564fed28c5902cbed40361e9924afc8ccaa9f5d535b5b35cc019f06588"
}
