{
  "schema": "settlement.receipt/v2",
  "settlement_id": "00000000-0000-0000-0000-000000000302",
  "intent_id": "00000000-0000-0000-0000-000000000202",
  "payer_id": "external-customer-001",
  "payee_id": "project-001-revenue-account",
  "providers": [],
  "source_asset": "USDC",
  "source_amount": "125",
  "target_asset": "USDC",
  "target_amount": "125",
  "fees": [],
  "status": "SETTLED",
  "finality_time": "2026-08-19T10:01:00Z",
  "external_evidence_classes": [],
  "external_references": ["bank-revenue-001"],
  "settlement_evidence_digest": "7777777777777777777777777777777777777777777777777777777777777777",
  "reconciled": true,
  "route_id": null,
  "causal_binding": {
    "flow_kind": "PROJECT_REVENUE",
    "project_id": "project-001",
    "payment_purpose": "productive_project_revenue",
    "intent_idempotency_key": "project-001-revenue-001",
    "intent_binding_digest": "1d3e9857fa5012d0566d60f69e705a9ea071943c750e0fe6dba35b4da3df4dbd",
    "capital_authorization_schema": "capital.authorization/v2",
    "capital_authorization_digest": "1e814153a18850865543e08b498b60d9bce80dbd34bfb2f4c378f3fe502fe89f",
    "project_evidence_schema": "project.evidence/v1",
    "project_evidence_digest": "6666666666666666666666666666666666666666666666666666666666666666"
  },
  "authority": "SETTLEMENT_EVIDENCE_ONLY",
  "settlement_authority": "Shtenco/synergy_pay_system",
  "accounting_authority": "Shtenco/synergy_financial_os",
  "profit_recognition": "NOT_PERFORMED",
  "execution_authority": "NONE",
  "receipt_digest": "cd3a1886789eb431dde2b06feb4236bcf0f5d6f97f327de9204ec437fb8222e8"
}
